{
  "phase": "implement",
  "target_id": "DASH-01-dashboard-content-scaffold",
  "assessed_at": "2026-07-08T18:49:00.000Z",
  "ok": true,
  "coverage_pct": 100,
  "coverage_confidence_pct": 88,
  "functional_ok": true,
  "criteria_audit": [
    {
      "id": "AC-1",
      "status": "pass",
      "evidence": [
        "frontend/src/components/dashboard/DashboardMain.tsx",
        "frontend/src/pages/Dashboard.tsx"
      ],
      "gap": null
    },
    {
      "id": "AC-2",
      "status": "pass",
      "evidence": [
        "frontend/src/components/dashboard/DashboardMain.tsx",
        "frontend/src/lib/dashboard/routes.ts"
      ],
      "gap": null
    },
    {
      "id": "AC-3",
      "status": "pass",
      "evidence": [
        "frontend/src/hooks/useDashboardUser.ts",
        "frontend/src/components/dashboard/DashboardMain.tsx",
        "frontend/src/components/dashboard/DashboardGreetingCard.tsx"
      ],
      "gap": null
    }
  ],
  "functional_audit": [
    {
      "id": "FV-1",
      "check": "DashboardMain mounts inside SHELL-06 DashboardLayout content slot with ai_RNbBHXRD boundary",
      "status": "pass",
      "evidence": [
        "frontend/src/pages/Dashboard.tsx",
        "frontend/src/components/DashboardLayout.tsx",
        "frontend/src/components/dashboard/DashboardMain.tsx"
      ]
    },
    {
      "id": "FV-2",
      "check": "dashboard-grid uses fluid responsive two-column layout (stacked on narrow viewports)",
      "status": "pass",
      "evidence": ["frontend/src/components/dashboard/DashboardMain.tsx"]
    },
    {
      "id": "FV-3",
      "check": "useDashboardUser composable supplies display fields to slot children via DashboardUserProvider",
      "status": "pass",
      "evidence": [
        "frontend/src/hooks/useDashboardUser.ts",
        "frontend/src/components/dashboard/DashboardGreetingCard.tsx"
      ]
    },
    {
      "id": "FV-4",
      "check": "Incomplete-profile branch preserves scaffold regions and slot bubble-id markers",
      "status": "pass",
      "evidence": ["frontend/src/pages/Dashboard.tsx"]
    }
  ],
  "ui_evidence": [
    { "bubble_id": "bTHDT", "selector": "[data-bubble-id='bTHDT']", "status": "pass" },
    { "bubble_id": "ai_RNbBHXRD", "selector": "[data-bubble-id='ai_RNbBHXRD']", "status": "pass" },
    { "bubble_id": "ai_RNbBHXRE", "selector": "[data-bubble-id='ai_RNbBHXRE']", "status": "pass" },
    { "bubble_id": "ai_RNbBHXRF", "selector": "[data-bubble-id='ai_RNbBHXRF']", "status": "pass" },
    { "bubble_id": "ai_RNbBHXRW", "selector": "[data-bubble-id='ai_RNbBHXRW']", "status": "pass" },
    { "bubble_id": "ai_RNbBHXRX", "selector": "[data-bubble-id='ai_RNbBHXRX']", "status": "pass" }
  ],
  "gaps": [],
  "blockers": [],
  "critiques": [
    {
      "id": "C-1",
      "area": "scaffold-slot-population",
      "priority": "medium",
      "finding": "Incomplete-profile branch omits currentPath, chatPreview, and journalPreview slot children.",
      "alternative": "Mount downstream widget components in the incomplete branch too.",
      "evidence": ["frontend/src/pages/Dashboard.tsx"]
    },
    {
      "id": "C-2",
      "area": "ui-fidelity",
      "priority": "medium",
      "finding": "beforeGrid renders ContinueOnboardingBanner inside ai_RNbBHXRE rather than sibling to dashboard-content.",
      "alternative": "Move beforeGrid to sibling of ai_RNbBHXRE per DASH-07 layout_notes.",
      "evidence": [
        "frontend/src/components/dashboard/DashboardMain.tsx",
        "frontend/src/components/dashboard/ContinueOnboardingBanner.tsx"
      ]
    }
  ],
  "scores": { "completeness": 5, "grounding": 4, "actionability": 4 }
}
