{
  "phase": "implement",
  "target_id": "CHAT-02-conversation-thread-sidebar",
  "assessed_at": "2026-07-09T10:45:00.000Z",
  "ok": true,
  "coverage_pct": 100,
  "coverage_confidence_pct": 89,
  "functional_ok": true,
  "criteria_audit": [
    {
      "id": "AC-1",
      "status": "pass",
      "evidence": [
        "frontend/src/components/chat/ConversationSidebar.tsx — root data-bubble-id ai_RNbBHXbK; RG container ai_RNbBHXbL",
        "frontend/src/components/chat/ConversationThreadCell.tsx — cell root ai_RNbBHXbM with nested bN→(bO+bR); bO children bP select button + bQ date text",
        "ir/inventory.json — hierarchy ai_RNbBHXbK→bL→bM→bN→(bO,bR); bO→(bP,bQ); bR→(bS,bU)",
        "frontend/src/lib/chat/routes.ts — CHAT-02 bubble id constants match IR element ids"
      ],
      "gap": null
    },
    {
      "id": "AC-2",
      "status": "pass",
      "evidence": [
        "frontend/src/lib/chat/chatConversationsApi.ts — fetchConversations queries chatconversation for user_user ordered by modified_date desc",
        "frontend/src/lib/chat/chatConversationsApi.ts — preview text resolved via chatmessage lookup; no adapter passthrough",
        "frontend/src/components/chat/ConversationSidebar.tsx — loadConversations invokes fetchConversations on mount and listVersion bump"
      ],
      "gap": null
    },
    {
      "id": "AC-3",
      "status": "pass",
      "evidence": [
        "frontend/src/lib/chat/chatRouteStore.ts — useChatConversationParam reads/writes ?conversation= via setSearchParams(prev=>…) preserving other params",
        "frontend/src/components/chat/ConversationThreadCell.tsx — isActive applies bg-accent highlight on ai_RNbBHXbM when id matches URL param",
        "frontend/src/components/chat/ConversationThreadCell.tsx — bP onClick calls onSelect → setConversationId"
      ],
      "gap": null
    },
    {
      "id": "AC-4",
      "status": "pass",
      "evidence": [
        "frontend/src/components/chat/ConversationThreadCell.tsx — bR actions group with bS (rename) and bU (delete) preserving IR sibling hierarchy under bN",
        "frontend/src/pages/Chat.tsx — handleDeleteRequest sets deleteTarget; DeleteConversationPopup receives bound conversation",
        "frontend/src/components/chat/DeleteConversationPopup.tsx — CHAT-04 popup opens when deleteTarget !== null"
      ],
      "gap": null
    },
    {
      "id": "AC-5",
      "status": "pass",
      "evidence": [
        "frontend/src/hooks/useEmptyConversationBootstrap.ts — bTInQ parity: empty non-loading list triggers createConversation then setConversationId",
        "frontend/src/lib/chat/chatConversationsApi.ts — createConversation inserts chatconversation row (bTInY NewThing parity)",
        "frontend/src/components/chat/ConversationSidebar.tsx — bootstrap hook wired after fetchConversations with onBootstrapped reload"
      ],
      "gap": null
    }
  ],
  "functional_audit": [
    {
      "id": "FV-1",
      "check": "ConversationSidebar renders thread list with IR bubble markers ai_RNbBHXbK/bL and per-cell ai_RNbBHXbM hierarchy",
      "status": "pass",
      "evidence": [
        "frontend/src/components/chat/ConversationSidebar.tsx",
        "frontend/src/components/chat/ConversationThreadCell.tsx",
        "frontend/src/pages/Chat.tsx"
      ]
    },
    {
      "id": "FV-2",
      "check": "Thread list loads current-user chatconversation rows via Supabase client ordered by modified date",
      "status": "pass",
      "evidence": [
        "frontend/src/lib/chat/chatConversationsApi.ts",
        "frontend/src/components/chat/ConversationSidebar.tsx"
      ]
    },
    {
      "id": "FV-3",
      "check": "Selecting a thread cell updates /chat?conversation=<id> while preserving other URL search params",
      "status": "pass",
      "evidence": [
        "frontend/src/lib/chat/chatRouteStore.ts",
        "frontend/src/components/chat/ConversationSidebar.tsx"
      ]
    },
    {
      "id": "FV-4",
      "check": "Delete control (bU) opens DeleteConversationPopup with the selected chatconversation bound",
      "status": "pass",
      "evidence": [
        "frontend/src/components/chat/ConversationThreadCell.tsx",
        "frontend/src/pages/Chat.tsx",
        "frontend/src/components/chat/DeleteConversationPopup.tsx"
      ]
    },
    {
      "id": "FV-5",
      "check": "Empty repeating group bootstraps first chatconversation and navigates to ?conversation=<new_id> (bTInQ/bTInY/bTInW)",
      "status": "pass",
      "evidence": [
        "frontend/src/hooks/useEmptyConversationBootstrap.ts",
        "frontend/src/lib/chat/chatConversationsApi.ts"
      ]
    }
  ],
  "ui_evidence": [
    {
      "bubble_id": "ai_RNbBHXbK",
      "selector": "[data-bubble-id='ai_RNbBHXbK']",
      "status": "pass"
    },
    {
      "bubble_id": "ai_RNbBHXbL",
      "selector": "[data-bubble-id='ai_RNbBHXbL']",
      "status": "pass",
      "notes": "RepeatingGroup_list_ style_ref not applied — Tailwind overflow-y-auto only"
    },
    {
      "bubble_id": "ai_RNbBHXbM",
      "selector": "[data-bubble-id='ai_RNbBHXbM']",
      "status": "pass",
      "notes": "Active conditional bg-accent on cell root matches IR selected-state intent"
    },
    {
      "bubble_id": "ai_RNbBHXbN",
      "selector": "[data-bubble-id='ai_RNbBHXbN']",
      "status": "pass"
    },
    {
      "bubble_id": "ai_RNbBHXbO",
      "selector": "[data-bubble-id='ai_RNbBHXbO']",
      "status": "pass"
    },
    {
      "bubble_id": "ai_RNbBHXbP",
      "selector": "[data-bubble-id='ai_RNbBHXbP']",
      "status": "pass",
      "notes": "Select button carries title + preview spans; IR bP is Button with dynamic text bindings"
    },
    {
      "bubble_id": "ai_RNbBHXbQ",
      "selector": "[data-bubble-id='ai_RNbBHXbQ']",
      "status": "pass"
    },
    {
      "bubble_id": "ai_RNbBHXbR",
      "selector": "[data-bubble-id='ai_RNbBHXbR']",
      "status": "pass"
    },
    {
      "bubble_id": "ai_RNbBHXbS",
      "selector": "[data-bubble-id='ai_RNbBHXbS']",
      "status": "pass",
      "notes": "Button_icon_ style via bubbleStyle; rename handler is no-op stub in Chat.tsx"
    },
    {
      "bubble_id": "ai_RNbBHXbU",
      "selector": "[data-bubble-id='ai_RNbBHXbU']",
      "status": "pass"
    },
    {
      "bubble_id": "RepeatingGroup_list_",
      "selector": "[data-style-ref='RepeatingGroup_list_']",
      "status": "partial",
      "notes": "IR list RG style exists in styles.json but ai_RNbBHXbL container has no data-style-ref or bubbleStyle(RepeatingGroup_list_)"
    }
  ],
  "gaps": [],
  "blockers": [],
  "critiques": [
    {
      "id": "C-1",
      "area": "data-layer",
      "priority": "medium",
      "finding": "fetchConversations and createConversation fall back to profiles.onboarding_data when chatconversation/chatmessage tables are absent (supabase has no chat migrations). AC-2 names table query only.",
      "alternative": "Land supabase chatconversation migration so the primary Supabase table path is always exercised; keep onboarding fallback only for migration rollout.",
      "evidence": [
        "frontend/src/lib/chat/chatConversationsApi.ts",
        "supabase/"
      ]
    },
    {
      "id": "C-2",
      "area": "functional",
      "priority": "low",
      "finding": "Rename trigger ai_RNbBHXbS is wired through onRenameRequest but Chat.tsx handleRenameRequest is an intentional no-op — icon renders without opening a rename flow.",
      "alternative": "Defer to a rename-popup item or wire inline title edit; document as out-of-scope in decompose if rename is not required for CHAT-02 gate.",
      "evidence": [
        "frontend/src/pages/Chat.tsx",
        "frontend/src/components/chat/ConversationThreadCell.tsx"
      ]
    },
    {
      "id": "C-3",
      "area": "ui-fidelity",
      "priority": "medium",
      "finding": "Repeating group ai_RNbBHXbL omits RepeatingGroup_list_ style_ref from ir/slices/styles.json (border/background list presentation).",
      "alternative": "Apply bubbleStyle('RepeatingGroup_list_') or equivalent token mapping on the RG scroll container.",
      "evidence": [
        "frontend/src/components/chat/ConversationSidebar.tsx",
        "ir/slices/styles.json — RepeatingGroup_list_"
      ]
    },
    {
      "id": "C-4",
      "area": "resilience",
      "priority": "low",
      "finding": "useEmptyConversationBootstrap sets bootstrappedRef before async createConversation completes; a failed create will not retry on subsequent renders.",
      "alternative": "Set bootstrappedRef only after successful create, or reset on failure with user-visible error toast.",
      "evidence": [
        "frontend/src/hooks/useEmptyConversationBootstrap.ts"
      ]
    }
  ],
  "scores": {
    "completeness": 5,
    "grounding": 4,
    "actionability": 4
  }
}
