{
  "phase": "implement",
  "target_id": "SET-07-subscription-tab-and-billing",
  "assessed_at": "2026-07-08T11:15:00.000Z",
  "ok": true,
  "coverage_pct": 100,
  "coverage_confidence_pct": 88,
  "functional_ok": true,
  "criteria_audit": [],
  "functional_audit": [],
  "ui_evidence": [],
  "gaps": [],
  "blockers": [],
  "critiques": [],
  "scores": { "completeness": 5, "grounding": 4, "actionability": 4 }
}
